,user_name,created_at,attitudes_count,comments
753,古早味全糖去冰加奶盖,Sat Nov 21 00:55:13 +0800 2020,0,集中回一下几点疑惑。这条博文里没有一点要男士“退让”的意思，这是一份防诬告指南呀，指的是在遭受诬告前，如何尽可能避免，要真发生了，怎么办咱再说嘛。无意触碰说的“道歉”并不是“退让”的道歉，指的是不小心触碰到陌生人而说的抱歉，不论男女同性异性，都该说声抱歉呀，私以为这是基本公德。
754,朱武奋斗中,Sat Nov 21 00:52:42 +0800 2020,0,不招男人不是更省事？全是女员工，智商优秀学历高，吸烟酒都没了工作效率奇高
755,不在考研就在考研路上,Sat Nov 21 00:50:03 +0800 2020,0,知情同意有啥用，该诬告还是一样。
756,朱武奋斗中,Sat Nov 21 00:48:25 +0800 2020,0,我觉得能上清华的没有蠢人，谢谢夸奖
757,只因有你442,Sat Nov 21 00:46:43 +0800 2020,0,没骂学弟是因为1. 梁颖事件让网友知道要理性吃瓜不急着表态2.反转太快。 至于为什么选择和解，一是估计学弟不想再折腾了，二是学校肯定逼着他和解啊，不想和解也得和解。学校的最重要目标肯定是把这个负面舆情的热度降下去。
758,朱武奋斗中,Sat Nov 21 00:46:29 +0800 2020,0,现在不是已经这样了吗？男生为了打击女性竞争对手，已经敢对主考官说那是我女朋友了！就是要让他们知道女生不能沾！敢这么说就会社死！
759,梁喵喵miao,Sat Nov 21 00:45:36 +0800 2020,0,事实是冲在一线抗疫的有70%是女医护，而全员男医护冲一线只存在于你的假设里。
760,re54g5,Sat Nov 21 00:45:32 +0800 2020,0,你跟清华这女的一样蠢，真是色狼，还会站在原地给你个人信息，让你发朋友圈网暴？
761,长岛毅梦WWW,Sat Nov 21 00:44:27 +0800 2020,0,直接一点，女人别出门，整那么多事干嘛
762,朱武奋斗中,Sat Nov 21 00:44:12 +0800 2020,0,现在连公务员都已经明目张胆限男性了，虐杀妻子只判四年，我觉得这种大环境下，矫枉过正是必须的，退让永远换不来平等，只能争！让他们知道女人不能欺负，碰都不能碰！
763,S不可,Sat Nov 21 00:43:28 +0800 2020,0,你啥玩意儿，我就啥玩意儿啊。是吧。
764,梁喵喵miao,Sat Nov 21 00:42:47 +0800 2020,0,历史的车轮滚滚向前，妇女解放运动任何人都无法阻挡。所以你爱觉得怎样都无所谓，妇女永远不会再退出劳动市场，你的想法就只是做梦而已。
765,Becky_在南极,Sat Nov 21 00:42:18 +0800 2020,0,"不能再赞同了，快进到华人就在这一代终结男女婚姻下一代灭亡[太开心]Go, Chinese!"
766,Baneslayer2018,Sat Nov 21 00:41:41 +0800 2020,0,so？男医护怎么了？看不起男医护？男医护冲一线没问题啊？
767,语文很差的Amano,Sat Nov 21 00:41:26 +0800 2020,0,哈哈哈哈哈哈哈我以为你是反对恶臭男性，没想到你是想成为他们（的性转版）哈哈哈哈[允悲]恭喜你，你成功了[good]
768,大大个旭,Sat Nov 21 00:40:55 +0800 2020,0,你知道你说这话显得多无知吗，真的槽点多的不知道怎么反驳，希望你能抓住纲而不是目，再告诉你一个小故事，拜登支持妇女能顶半边天被骂通共，大概女权不支持共产主义的解放妇女运动[笑哈哈]多读书不是坏处[笑哈哈]先读读书再在网上说出你的观点吧，小朋友
769,语文很差的Amano,Sat Nov 21 00:39:29 +0800 2020,0,那我只能说微博算法真的牛[作揖]，能这么精准的跟咱们推送内容[允悲]
770,梁喵喵miao,Sat Nov 21 00:39:11 +0800 2020,0,你以为女人喜欢忍受各种痛苦生孩子吗？我们巴不得哪天技术进步，孩子可以让男人去生。而没有了母职惩罚，女人在职场上会比现在有竞争力得多。
771,熊~白,Sat Nov 21 00:38:56 +0800 2020,0,这么说把女婴堕胎其实是一种保护？
772,币圈社区讨论,Sat Nov 21 00:38:13 +0800 2020,0,[污]
773,古早味全糖去冰加奶盖,Sat Nov 21 00:37:39 +0800 2020,0,您看看清华这个事情，大家有骂这位学弟吗？心疼还来不及！学姐已经被大家骂穿了。我也觉得学弟不应该退让，他的名誉受到影响的话完全应该用法律的武器保护自己。（当然他选择和解的话我觉得也不能说他软弱什么的）
774,核桃小桃核,Sat Nov 21 00:37:08 +0800 2020,0,是的，我的生日娘的苦日。不冲突。换点其他的论据
775,只因有你442,Sat Nov 21 00:36:48 +0800 2020,0,斯文说得对，一定要第一时间报警。这个指南估计是梁颖、李星星和清华屁股姐合作的成果。
776,爱尼德抛瓦,Sat Nov 21 00:36:48 +0800 2020,0,好一个认真道歉“希望你不要不识抬举”
777,古早味全糖去冰加奶盖,Sat Nov 21 00:36:44 +0800 2020,0,hhhhhh您阅读能力再提高提高？预防诬告您看到了吗？具体真的被诬告要怎么办，我这还没写到呢～您看，我这边也写了，不慎碰到的话应该及时声明，这不刚好就是您说的“为了平事一怂一道歉”的反面嘛，咱俩是一个意思呀。
778,核桃小桃核,Sat Nov 21 00:36:10 +0800 2020,0,嗯也是猜到回复内容系列。所以说，雌猴子最大的敌人就是克隆技术。
779,系小山,Sat Nov 21 00:36:05 +0800 2020,0,原来你读马哲是为了屈从资本、顺应资本，马克思棺材板都要盖不住了。
780,核桃小桃核,Sat Nov 21 00:35:13 +0800 2020,0,猜到回复系列[嘻嘻]
781,大大个旭,Sat Nov 21 00:34:49 +0800 2020,0,大胆，我已经原谅你了[doge]
782,山舞银蛇兮原驰蜡象,Sat Nov 21 00:34:10 +0800 2020,0,应该当场否认，马上用杨笠的名言反击她
783,大大个旭,Sat Nov 21 00:33:22 +0800 2020,0,你去给资本说这个去吧，看看资本怎么选择的[笑哈哈]继续闹，资本可没有你那些大道理，读读马哲不吃亏
784,社会主义新时代女德,Sat Nov 21 00:32:58 +0800 2020,0,博主的逻辑[并不简单]
785,寺临蓝溪阁,Sat Nov 21 00:32:39 +0800 2020,0,女人不说你是性骚扰就不错了，还要女人道歉？
786,Dr-Wonderwho,Sat Nov 21 00:31:42 +0800 2020,0,希望所有男的都能真正做到，这样这个世界该多美好
787,梁喵喵miao,Sat Nov 21 00:31:41 +0800 2020,0,对，这样抗疫的时候冲在前面的就都是男医护了。
788,大大个旭,Sat Nov 21 00:31:31 +0800 2020,0,继续闹吧，这么闹下去看吃亏的是谁，为了避嫌不招女学生喝女员工了，看看谁最后被资本吸干了血[doge]
789,black理学爱好者,Sat Nov 21 00:31:21 +0800 2020,0,那为什么不是互相道歉
790,古早味全糖去冰加奶盖,Sat Nov 21 00:30:21 +0800 2020,0,因为这条是写给男士的防诬告啊hhhhhh，就说了男士要道歉。公共场合不慎和陌生人肢体接触，不论对方是男是女，自己是男是女，都应该向对方道歉呀，这不是基本的礼貌吗？
791,梁喵喵miao,Sat Nov 21 00:30:19 +0800 2020,0,有本事你别找老婆，靠自己生个孩子试试。连孩子都生不出来，活脱脱一个残疾品种。
792,威斯特法伦的挂猪蹄,Sat Nov 21 00:29:57 +0800 2020,0,是这么个道理 直来直去 快意恩仇
793,大大个旭,Sat Nov 21 00:29:42 +0800 2020,0,她那么普通，又那么自信
794,天佑jimpy,Sat Nov 21 00:29:41 +0800 2020,0,你把那个叫做“认真道歉”[疑问]
795,大大个旭,Sat Nov 21 00:28:49 +0800 2020,0,这就是定势思维了[笑哈哈]和男的骂女的有什么区别？你们都一样恶臭[怒]
796,MurphLLL,Sat Nov 21 00:28:14 +0800 2020,0,没啊，我老看见女性对女性说“这样一竿子打死和你们最讨厌的人有什么区别”的绝对温和笨蛋中立，和到处都是的“打拳警告[喵喵]”、“兄弟你这是捅了田园窝了[允悲]”
797,梁喵喵miao,Sat Nov 21 00:26:09 +0800 2020,0,只有这种时候男人才会觉得规训受害者是不对的吧。看看各种女性被性骚扰的话题下面，发表受害者有罪论的基本都是男的；拿出一副我是为你好的样子劝女人多穿点的，也都是男的。至于防诬告指南这种东西，只能说天道好轮回，苍天饶过谁。
798,鸟鸣贱Neo,Sat Nov 21 00:24:44 +0800 2020,0,上述这些和对女生「别穿这么暴露」的区别是？
799,法棍奇兵,Sat Nov 21 00:23:33 +0800 2020,0,总结：珍爱生命，远离女人[兔子]
800,XZHLHLHLHLHLHLHL,Sat Nov 21 00:22:36 +0800 2020,0,要劳资说几遍？
801,功成身退身后事,Sat Nov 21 00:22:33 +0800 2020,0,是咎由自取，道歉与在无证据下就暴露别人隐私根本就是两码事，违法难道道歉就可以了事？不用承担后果？套用烂大街的话，如果道歉有用要警察何用？在她无理由暴露他人隐私引发暴力的时候她就该想到由此引发后果的反噬
802,Motacilla-Mirror姨你也好,Sat Nov 21 00:22:32 +0800 2020,0,因为通道狭窄过度拥挤之类的事情凑近别人的时候说抱歉…至少我所在的国家不分男女都会这样
803,波斯小昭1,Sat Nov 21 00:22:20 +0800 2020,0,然→//@蘸盐: 女性遇到骚扰的几率远大于无辜男性被误认骚扰的几率。清华学姐的不妥之处在于，在没有确认确实是性骚扰的情况下，曝光对方个人信息。就她的个例来说，被网络暴力反噬，算是咎由自取。但希望更多的男性也理解下女性的困难之处。性别撕裂和性别仇恨，无论来自哪一方，都是不对的。
804,XZHLHLHLHLHLHLHL,Sat Nov 21 00:22:13 +0800 2020,0,我说了性骚扰主动往上蹭和不小心碰到是他妈的不一样的，听不懂人话？
805,年轻瞎位移,Sat Nov 21 00:20:17 +0800 2020,0,后面说的都很对，可是这不是防诬告指南啊，这只是一个尊重女性的指南啊。。。。。。
806,语文很差的Amano,Sat Nov 21 00:20:00 +0800 2020,0,介介，你看下微博的舆论环境，随便看看也知道是骂国蝻的多还是骂田园的多（至少骂田园的还能带一些指向性……
807,black理学爱好者,Sat Nov 21 00:19:22 +0800 2020,0,诬告了可能会被清华学姐这样网爆
808,black理学爱好者,Sat Nov 21 00:18:42 +0800 2020,0,你啥逻辑？
809,系小山,Sat Nov 21 00:17:58 +0800 2020,0,我不明白，如果没做错或者没做出令人误会的事，为什么要怕招女性呢？还是说自己心里有鬼，默认自己会犯错所以避免招聘女性？瓜田不纳履李下不整冠是种避嫌，是可以做到的。但是为了避免结果而避免开始，是屁股歪了。
810,语文很差的Amano,Sat Nov 21 00:17:39 +0800 2020,0,就事论事确实是太难了，好吧，你接下来可以由性别优势扩大到几千年的男权社会对女性的压迫，然后我再扩大到上百万年的母系社会对男性的压迫，这么聊天也就没劲了。就这样吧，和你聊天我还是有收获的，谢谢你（Ps.下次如果有谴责偷拍的话题，那下面讨论里我绝对是支持你的，加油(?? ????_????)??
811,Tina罗大黑,Sat Nov 21 00:17:33 +0800 2020,0,因为不道歉就会被诬告，所以好好守男德，别和女的一般见识，保护好自己就可以了。
812,炼狱-夺魄,Sat Nov 21 00:17:04 +0800 2020,0,例如某教把女性套在垃圾袋里保护起来
813,Tina罗大黑,Sat Nov 21 00:16:02 +0800 2020,0,还是男的不够洁身自好[喵喵]
814,Tina罗大黑,Sat Nov 21 00:15:41 +0800 2020,0,说到做到
815,Tina罗大黑,Sat Nov 21 00:15:24 +0800 2020,0,偷拍
816,Tina罗大黑,Sat Nov 21 00:15:11 +0800 2020,0,你妈真惨下了你个傻蛋
817,MurphLLL,Sat Nov 21 00:15:07 +0800 2020,0,可是你不觉得我刚刚说的女性的要求有一点离谱吗？因为极少有女性以普通肢体接触勒索性骚扰，但是有很多男性“死刑不亏”“田园女蛆”。所以前者不需要要求，而后者作要求时居然还他妈的会“变味儿”
818,经年留影丶,Sat Nov 21 00:14:44 +0800 2020,0,身为女生也被“小白花女生”搞过[跪了][跪了]真的，这种坏人看性别下定义绝对吃亏
819,Tina罗大黑,Sat Nov 21 00:14:16 +0800 2020,0,这才是男孩子正常的样子
820,币圈社区讨论,Sat Nov 21 00:12:16 +0800 2020,0,男的被女的不小心碰一下那怎么办？能不能先把女的拉去派出所，然后在网上diss一翻？
821,经年留影丶,Sat Nov 21 00:12:01 +0800 2020,0,你这说的跟女人不会蹭男人一样，女的碰到帅哥拍照，偶遇相撞还少吗？[太开心]别想当然的说话
822,MurphLLL,Sat Nov 21 00:11:22 +0800 2020,0,这时候就要求男性不要在无监控的情况下和女性独处、必要时架设录像设备了。快从优势性别中醒醒吧，看看顶门器警报器防狼喷雾打车汇报群测评的千万播放量吧，我们谴责犯罪也要保护好自己，ok？
823,炼狱-夺魄,Sat Nov 21 00:11:01 +0800 2020,0,生不生是自己选择可以建议。倒是企业，单位，学校之类的男领导真的应该考虑好，招一个女下属对自己和内部有很大风险的。为了不麻烦招聘的时候偏向性也会更强
824,语文很差的Amano,Sat Nov 21 00:09:48 +0800 2020,0,恶臭要求是要看这个要求的原因的[黑线]，提取出来一句话放到A情景里就是公序良俗，放到B情景里就有可能变味儿
825,悠蓝轩轩,Sat Nov 21 00:09:13 +0800 2020,0,真碰到#清华学姐#这事，一句话不认啊，你说性骚扰拿证据呗，谁控告谁举证，哪有让被告人举证的道理。
826,WAYG万里,Sat Nov 21 00:07:45 +0800 2020,0,觉得被性骚扰就报警，哪来的自己执法的道理？
827,XZHLHLHLHLHLHLHL,Sat Nov 21 00:07:33 +0800 2020,0,要是真没站稳倒人家身上了也要道个歉，确实是碰到别人了
828,XZHLHLHLHLHLHLHL,Sat Nov 21 00:06:40 +0800 2020,0,没站稳和性骚扰主动往上蹭是一回事吗[疑问]
829,语文很差的Amano,Sat Nov 21 00:05:08 +0800 2020,0,你说的是接触异性身体啊[允悲]咱们把这个不适的范围不要扩大，那还是可以讨论的[允悲]冒犯的程度和有心算无心的情况都很难解决，有些东西最稳妥的还是交给法律，虽然有些事儿法律也很难判断。
830,系小山,Sat Nov 21 00:05:02 +0800 2020,0,那就建议女人避免生出男性好不好呀
831,达芬奇的鸡蛋,Sat Nov 21 00:04:51 +0800 2020,0,所以清华学弟是违反了哪一条呢？
832,工铲小报BBC,Sat Nov 21 00:04:52 +0800 2020,0,男德班开课了[doge]
833,炼狱-夺魄,Sat Nov 21 00:04:13 +0800 2020,0,企业，学校，单位尽量避免招聘女性员工，学生会省很多麻烦。避免瓜田李下要不会让其身败名裂的
834,我就是叨叨,Sat Nov 21 00:03:59 +0800 2020,0,我见过女人没站稳踉跄倒在男人身上的
835,烟雨春遥,Sat Nov 21 00:02:42 +0800 2020,0,不要把诬陷当做枪来使，伤的只会是自己， 只知道社死，不知道有样东西叫生理死亡吗，但凡碰到个极端的，就只能见法医了，舆论也不会同情诬陷者，，名副其实的杀人诛心呢。避开女人你说的对呢，建议男性开的公司就不要招女人了吧，很高风险
836,暗搓搓撸个文,Sat Nov 21 00:02:37 +0800 2020,0,就说了是因为大环境如此女性才那么敏感，要是不存在那些故意猥亵、拍裙底的猥琐男，就不会有女性因为被一个包撞到屁股而误会是被人故意摸到了。那博主提出的正是解决办法，所有男性自己学会保持绅士距离，别做那些不道德的事情那就没有女性会因此敏感，也没有男性会被诬告了
837,带鱼打不过咸鱼,Sat Nov 21 00:02:30 +0800 2020,0,确实确实确实
838,re54g5,Sat Nov 21 00:02:17 +0800 2020,0,这女的就一蠢蛋，男的真要是色狼，会老老实实给你个人信息？还洋洋得意发朋友圈让人社死，被暴力反噬也是话该
839,炼狱-夺魄,Sat Nov 21 00:01:41 +0800 2020,0,像各个单位，企业，学校男领导都应该避免招女下属。真要是要诬陷你不管你声望怎么样，都可能让你们身败名裂[二哈][二哈][二哈]
840,XZHLHLHLHLHLHLHL,Sat Nov 21 00:01:40 +0800 2020,0,害，就嗯在那给我扣帽子，我没讲过都往头上扣，就很离谱
841,重新做人小希南,Sat Nov 21 00:00:43 +0800 2020,0,那是，毕竟是我觉得的
842,鸷鸟_pu,Sat Nov 21 00:00:30 +0800 2020,0,上去
843,MurphLLL,Sat Nov 21 00:00:29 +0800 2020,0,哪里乱了？原博的“恶臭要求在哪里”？
844,鸷鸟_pu,Fri Nov 20 23:59:41 +0800 2020,0,23比较膈应，45有点膈应
845,MurphLLL,Fri Nov 20 23:59:22 +0800 2020,0,你看我最后一句话…就像女性被碰胸会觉得不适，男性被蹭下体也会觉得不舒服啊？
846,炼狱-夺魄,Fri Nov 20 23:59:21 +0800 2020,0,像办公室里的话，尽量减少女员工数据也会省了类似麻烦
847,沙雕道长233,Fri Nov 20 23:58:30 +0800 2020,0,爷不退让
848,S民所止-,Fri Nov 20 23:58:19 +0800 2020,0,那建议所有公共交通运营商向女性收四倍的票款，毕竟早高峰时段要保持距离的话一个女性至少占四个人的位置。同时建议所有雇主在面试时对女性做女权倾向调查，从根源上保持男女距离。请转发[心]
849,XZHLHLHLHLHLHLHL,Fri Nov 20 23:58:14 +0800 2020,0,谁管你？你啥玩意儿？
850,XZHLHLHLHLHLHLHL,Fri Nov 20 23:57:51 +0800 2020,0,你脑补的还真不少，给我扣“男人都应该躲着女人”的帽子啦，我误解的前提是楼主讲了这句话，而你脑补的前提是我根本没讲这句话，真是神奇
851,语文很差的Amano,Fri Nov 20 23:57:45 +0800 2020,0,你的这几个对标还是有些乱，那你是也承认原博中有恶臭要求了？原博针对诬告的6条建议里有正常建议也有恶臭要求，我们还是实事求是，不管对男生还是女生，恶臭要求就是恶臭要求，该反对的就一起反对呗？
852,炼狱-夺魄,Fri Nov 20 23:57:41 +0800 2020,0,这种事在名誉上没有任何退路。
853,语文很差的Amano,Fri Nov 20 23:57:36 +0800 2020,0,男性不小心碰触就要立刻“不好意思”，那两个人碰触了女性要不要也跟男性说“不好意思”？凭什么女性做个正常人就可以，男性需要多做事才能被当做正常人？介介，只要你的要求中男女换位一下不那么离谱的我都可以支持你，真的。遇到啥事儿，咱们实事求是，不要性别立场先行……
854,Hello-VT,Fri Nov 20 23:56:50 +0800 2020,0,割以永治，遇到诬告，裤子一脱。。。姐妹相称
855,你这样拿枪更好看,Fri Nov 20 23:56:31 +0800 2020,0,@烽惺 敢在这里开打吗
856,S不可,Fri Nov 20 23:56:30 +0800 2020,0,[微笑]好的！我把你当个屁。
857,XZHLHLHLHLHLHLHL,Fri Nov 20 23:56:10 +0800 2020,0,但凡我要是抠字眼或者楼主抠字眼就不会产生误解，当然，前提是这确实是误解[摊手]抠字眼的是你，而且之前我纠正你的问题并不是抠字眼，而是阅读理解问题[摊手]，请分清楚这两者的区别
858,醋栗与酒丶,Fri Nov 20 23:55:41 +0800 2020,0,你怎么理解是你的问题，你愿意脑补什么脑补什么，我没脑补吧，我看到的是事实吧，那你一个脑补的骂别人按原话理解的瞎？
859,核桃小桃核,Fri Nov 20 23:55:26 +0800 2020,0,猪跟男人说，你别猥亵我。男人傻了，他只是想杀猪卖钱而已啊。猪要有猪的觉悟，劝猪们耗子尾汁，猪的腚不是拿来猥亵用的。
860,XZHLHLHLHLHLHLHL,Fri Nov 20 23:54:23 +0800 2020,0,语言就是用来清晰表达意思和内涵的，这都讲不清楚怪别人误解？不会吧？
861,pkm1111,Fri Nov 20 23:53:41 +0800 2020,0,"清华男生太怂了,应该直接去对方宿舍或者教室用高音喇叭宣传真相,并在食堂等地贴传单,让更多人知道,这才是唯一解决办法"
862,醋栗与酒丶,Fri Nov 20 23:53:10 +0800 2020,0,是谁先开始扣字眼的？咋的？证据贴上了开始死不认账了？问你呢都在哪呢，自己脑补个都骂别人瞎？问你谁瞎呢，你是他肚子里的蛔虫。你知道他什么意思？
863,XZHLHLHLHLHLHLHL,Fri Nov 20 23:52:58 +0800 2020,0,楼主没急你倒是先急的跳脚了，有趣，楼主要是自己出来解释清楚我就当我是误会了，他自己不讲清楚怪别人误解他的意思？
864,嘤嘤怪高大壮,Fri Nov 20 23:52:27 +0800 2020,0,她要不发那个朋友圈。。。。。不就一点事儿没了？这可不就是教科书式咎由自取
865,我叫王雨晴,Fri Nov 20 23:51:43 +0800 2020,0,我觉得女性更需要保护，几千年来大家也是按照你这个想法实际操作的。
866,City_Ytic,Fri Nov 20 23:51:07 +0800 2020,0,避免不必要的麻烦，能少说话就少说话，能不遇见这事儿就别遇见……
867,XZHLHLHLHLHLHLHL,Fri Nov 20 23:50:49 +0800 2020,0,你继续抠字眼，楼主这种话说出来就别怕人误会[摊手]看来你是他肚子里的蛔虫知道他到底什么意思？
868,嘤嘤怪高大壮,Fri Nov 20 23:50:12 +0800 2020,0,平生最烦跟陌生人有肢体接触，被你言论真实整吐了   哪来的自信？？？
869,醋栗与酒丶,Fri Nov 20 23:49:56 +0800 2020,0,@black理学爱好者：第三点为什么碰到了男人就要道歉，为什么不是女人道歉          层主原话，都在哪呢？人家问碰上了为什么男人就要道歉，为什么不是女人道歉。。。碰上了本来就是两个人都可能有责任，人家问这句话有问题？还是那句话，谁瞎
870,多看少说但不能不说,Fri Nov 20 23:49:43 +0800 2020,0,[赞][赞][赞]
871,MurphLLL,Fri Nov 20 23:49:37 +0800 2020,0,哦不好意思我看了下不太对，凭什么女性要多做事才能保护自己而男性只是需要做个正常人。那就男性不口嗨主动表明尊重女性的立场手不小心接触异性身体立刻“不好意思”；女性平时不要总是拿普通胳膊碰胳膊的接触喊性骚扰、报警可以依法依规处理的性骚扰不闹大、手不小心接触异性身体立刻“不好意思”吧！
872,醋栗与酒丶,Fri Nov 20 23:48:25 +0800 2020,0,你瞎啊？人家问的是为什么是男的给女的道歉不是女的给男的道歉，都在哪呢？瞎成这样还把瞎挂嘴上？咋的你瞎你骄傲啊，家族称号是瞎么。这么光荣？
873,XZHLHLHLHLHLHLHL,Fri Nov 20 23:48:16 +0800 2020,0,@XZHLHLHLHLHLHLHL: 而且我第一条回复的这个人他的意思就是应该女的都给男的道歉，这不是脑子有毛病？我再发一次[摊手]
874,炼狱-夺魄,Fri Nov 20 23:47:35 +0800 2020,0,直接报警，第三方介入如果有诬陷的打官司
875,醋栗与酒丶,Fri Nov 20 23:46:59 +0800 2020,0,@XZHLHLHLHLHLHLHL：你见过女人会在公车上往男人身上蹭？脑子不好使就别出来说话     这是你回复的第一句，直接回复的层主，谁瞎？来，大声告诉我，谁瞎，我就喜欢打你这种玩意的脸。。。
876,XZHLHLHLHLHLHLHL,Fri Nov 20 23:46:45 +0800 2020,0,而且我第一条回复的这个人他的意思就是应该女的都给男的道歉，这不是脑子有毛病？
877,炼狱-夺魄,Fri Nov 20 23:46:19 +0800 2020,0,是咎由自取，男方要是没有监控的话就社会性死亡了。这个都属于诬陷犯罪了，犯罪成本太低。
878,身负八分书既可盗天下,Fri Nov 20 23:46:05 +0800 2020,0,所以一开始你们就该盯着那些不守规矩的人，叫他们守规矩才能尽量避免守规矩的人被不守规矩的连累，所谓天下兴亡匹夫有责，挺恰当的。
879,海伯利安失陷了,Fri Nov 20 23:45:40 +0800 2020,0,你应该是即没读过大学也没上过班，说你是培智学校出来的可能都高估你了
880,XZHLHLHLHLHLHLHL,Fri Nov 20 23:45:40 +0800 2020,0,我说脑子有毛病的那个是他说“往公车轮胎上蹭”，所以我说他脑子有毛病，眼瞎的可以
881,15Ativan・,Fri Nov 20 23:45:00 +0800 2020,0,姐妹别回复他了 影响正常思维逻辑
882,六月食郁及2020,Fri Nov 20 23:44:43 +0800 2020,0,还有另一只手呢
883,炼狱-夺魄,Fri Nov 20 23:44:02 +0800 2020,0,立马报警警方介入，如果诬陷的打官司赔偿精神损失费
884,醋栗与酒丶,Fri Nov 20 23:44:02 +0800 2020,0,反问说别人脑子不好使？嘴这么硬有意思？真以为别人都傻，看不出你怎么想的？装什么糊涂啊在这，没理了开始不承认了？说过的话都不敢承认，呵呵，自己感动自己去吧，本来以为说了这么多，能有几分讲道理，呵呵，高看你了
885,六月食郁及2020,Fri Nov 20 23:44:01 +0800 2020,0,地铁每个车厢都有摄像头 还好一点
886,炼狱-夺魄,Fri Nov 20 23:43:07 +0800 2020,0,立马报警，让警方介入
887,XZHLHLHLHLHLHLHL,Fri Nov 20 23:42:58 +0800 2020,0,“所以你说的是真是假我保持怀疑态度[摊手]，如果是真的当时就应该报警让人赔偿精神损失费”，本人的原回复，脑子不清醒还眼瞎就应该去医院看看
888,先随便取个名字好了,Fri Nov 20 23:42:40 +0800 2020,0,真好笑，蛆的借口就这？避嫌不会插兜拿东西？保持距离和避嫌一个都做不到那是人吗，就这？
889,MurphLLL,Fri Nov 20 23:42:02 +0800 2020,0,我的看法是这样：要求女性整齐着装不出入夜店防止被强奸的恶臭要求对标要求男性自带隐蔽摄像头书包剐蹭不立刻道歉的恶臭要求；建议女性出差带顶门器偷拍扫描器深夜不和陌生男性同乘电梯对标男性主动表明尊重女性不说“死刑不亏”不在无人情况接近女性的建议，可以吗？
890,XZHLHLHLHLHLHLHL,Fri Nov 20 23:41:09 +0800 2020,0,我是没见过啊，而且新闻上我也没见过，一个反问而已[摊手]后面有人说见过我也持怀疑态度而不是完全否定，语文是真不好
