,user_name,created_at,attitudes_count,comments
499,-陆-明-渊-,Sat Nov 21 10:52:31 +0800 2020,0,罗冠军就是强奸犯，别洗了。
500,时代度假酒店,Sat Nov 21 10:52:23 +0800 2020,0,不恐哈，是仇男
501,时代度假酒店,Sat Nov 21 10:51:35 +0800 2020,0,对立就对立哈，谁在意你啊，不爱看死去
502,我是路过桑,Sat Nov 21 10:51:31 +0800 2020,0,很好的实践指南，转给我周围的男孩们看了。
503,leno34567,Sat Nov 21 10:51:26 +0800 2020,0,物化女性的男权社会先把女人当人这个概念建立起来吧！
504,内裤偏执狂,Sat Nov 21 10:51:22 +0800 2020,0,君子不立危墙之下
505,我是路过桑,Sat Nov 21 10:51:06 +0800 2020,0,男孩子谨遵男德，大事化小小事化了这不是很好吗。被诬告了对名声有亏。在古代被异性摸到手臂，是要自己砍手的呀。
506,时代度假酒店,Sat Nov 21 10:50:56 +0800 2020,0,自己要会怎么做就不留言啦，今日男德经背了吗？
507,山风与月ovo,Sat Nov 21 10:49:44 +0800 2020,0,男的死一个顶女的死十个，等女的死十个再来跟男的死一个的对线，不然女的不值钱也不重要，男的就是人上人呢[二哈][二哈][二哈]
508,我是路过桑,Sat Nov 21 10:49:41 +0800 2020,0,男孩防诬告怎么能指望女生道歉呢。
509,时代度假酒店,Sat Nov 21 10:49:26 +0800 2020,0,男人守南德裹小脚，你看世界多美好[good]
510,小白龙与灵猫,Sat Nov 21 10:49:06 +0800 2020,0,平时不是这样规训女人的吗？到自己身上就跳脚了？
511,时代度假酒店,Sat Nov 21 10:48:36 +0800 2020,0,？傻子
512,我是路过桑,Sat Nov 21 10:48:20 +0800 2020,0,男孩子就是要洁身自好，和不好的男孩子划清界限，谨遵男德拉啊！
513,山风与月ovo,Sat Nov 21 10:48:18 +0800 2020,0,男性弱势？那男性离女性远点不就行了？不给让自己当弱势的机会不就行了？怎么着，难不成是性骚扰的时候是女生拉着男的的手了还是你们男的个个黄帝出门周围女的自愿往男的身上凑了？女生有事就是女生少出门，现在男的有事男的也怎么怎么样不对？国际驰名双标呗[打脸][打脸][打脸]
514,何夜择明,Sat Nov 21 10:48:15 +0800 2020,0,补一条：几百条讲性骚扰、性侵的微博不见有些男性那么关注、热心的回复，这条防诬告指南却被你们讨论得热火朝天。不是说诬告不应该被批评，是请各位反思一下，为什么只有在自己利益（名誉或日常规范)可能受到影响的情况下才如此之“热心”，平时把这股劲用来为反对性骚扰发声，现在还用写这些指南？
515,-百利甜不甜-,Sat Nov 21 10:48:12 +0800 2020,0,换个性别就立刻清醒系列[摊手][摊手][摊手][摊手]
516,时代度假酒店,Sat Nov 21 10:47:22 +0800 2020,0,不守南德没人要哦~
517,-百利甜不甜-,Sat Nov 21 10:46:57 +0800 2020,0,博主给出来的建议都很实用啊，怎么能叫绑架呢？？？
518,icchiy,Sat Nov 21 10:46:55 +0800 2020,0,不知道男的为什么要这么不乐意呢？up这是为你们好啊，就像女孩子遇到性骚扰的时候各方“好心人”都建议女孩子“不要穿着暴露，不要走夜路，不要去酒吧等场所”等等的，对女孩子进行这种规劝教育的时候说：“都是为女孩子的安全着想，难道你想被性骚扰吗？”同理，up主也是为男孩子着想啊，怎么就急了呢
519,怎么能通过取名,Sat Nov 21 10:46:33 +0800 2020,0,评论里的蛆都在急啥，这是为你好嘛
520,大杯香槟加珍珠,Sat Nov 21 10:46:16 +0800 2020,0,任何人不小心碰到别人应该道歉不是基本礼貌吗[疑问]
521,时代度假酒店,Sat Nov 21 10:45:30 +0800 2020,0,男人有南德就够了，你们不就是喜欢坏女人吗[挖鼻][挖鼻][挖鼻]
522,时代度假酒店,Sat Nov 21 10:44:50 +0800 2020,0,哈哈哈哈sd把你奶奶逗笑了
523,系小山,Sat Nov 21 10:44:40 +0800 2020,0,请问现在社死的是学姐还是学弟哦，要厉害也是这些故意要炒作的资本厉害吧。学姐一开始是做错了，但只是小范围曝光，并且已经在18号的时候在曝光的地方发布道歉5次，二人和解并相互道歉。但事情却再次被曝光出来，把学姐的信息全部爆出，这后面的事就远远超出一开始的误会事件，学姐付出的代价多的多
524,基妹说锤锤不胖,Sat Nov 21 10:44:22 +0800 2020,0,吊子虽然多次杀女人，但是不能受委屈[doge]
525,时代度假酒店,Sat Nov 21 10:44:03 +0800 2020,0,老男人上街露肚子也是正常礼节喽，一个个猪头样还敢对女性指手画脚
526,假装很粗杰里王,Sat Nov 21 10:43:29 +0800 2020,0,哇我平时就是这么做的，其实也不用处处小心，但心里就踏实很多
527,Incelkiller2号,Sat Nov 21 10:42:22 +0800 2020,0,直接别给男性升职，多提拔女教授不是更能葱源头上解决问题？[doge]
528,何夜择明,Sat Nov 21 10:42:16 +0800 2020,0,觉得不爽的男性，想想自己平时有没有对女孩说出类似“不要走夜路”的话；有没有开过让人不舒服的“玩笑”；有没有制止过性骚扰；有没有为性骚扰发过声。如果你屁都没做，就别觉得委屈，这不叫“挤占男性生存空间”，这叫为你们以前的所作所为付出代价，即使这代价仅仅是最正常不过的――尊重女性。
529,基妹说锤锤不胖,Sat Nov 21 10:42:02 +0800 2020,0,只要男人恪守远离女人，万事大吉
530,这山这海全都是你的,Sat Nov 21 10:41:35 +0800 2020,0,像你这样的店好女孩不多了??
531,这山这海全都是你的,Sat Nov 21 10:40:49 +0800 2020,0,别跟他bb了 男的巴不得被摸呢
532,Incelkiller2号,Sat Nov 21 10:40:40 +0800 2020,0,哈哈哈，评论区很多男的急了急了急了。这位博主提出的要求，不就是很多男性日常对女性的训导嘛？性别互换一下一个个马上跳脚了？
533,拳师终结者X5,Sat Nov 21 10:40:12 +0800 2020,0,抱歉，你原文说的是诬告，我在这里说的也是诬告啊。所以你的建议对我而言是没必要的，因为遇到的几率实在是太低。至于说到性骚扰，作为男性我也遇到过，只要是合法的维权途径，我都是支持的。
534,这山这海全都是你的,Sat Nov 21 10:37:46 +0800 2020,0,这男的太敏感了吧[摊手]那人家楼层比他高就是不想凑过去按想等他下去了再按怎么了，我就是遇到楼层比我低的、懒得凑过去按、等ta下去了再按楼层的那种人
535,古早味全糖去冰加奶盖,Sat Nov 21 10:36:07 +0800 2020,0,害！好女孩根本不用我写，我们都懂～
536,古早味全糖去冰加奶盖,Sat Nov 21 10:34:59 +0800 2020,0,您再睁大眼睛好好读读原博呢？预防诬告您看到了吗？诬告还没发生呢，找警察人家理你吗？再说了，您看看楼中的回复，我可一点没让男生妥协～
537,八面洞,Sat Nov 21 10:33:19 +0800 2020,0,我理解错了吗……不是在钓鱼吗？这种话不是对“女生不走夜路不会被qj”的嘲讽吗？
538,何夜择明,Sat Nov 21 10:32:37 +0800 2020,0,最干脆直接的方法不就是原博提到的1――别去性骚扰？
539,古早味全糖去冰加奶盖,Sat Nov 21 10:32:18 +0800 2020,0,晕 您是女的还是我是女的 我以及我的女性朋友可不是“一辈子”都碰不到性骚扰，建议您多和女的聊天。
540,古早味全糖去冰加奶盖,Sat Nov 21 10:30:52 +0800 2020,0,钓鱼哈哈哈哈哈哈哈哈 就硬钓 不钓也得掉！我笑死
541,古早味全糖去冰加奶盖,Sat Nov 21 10:29:25 +0800 2020,0,狂犬哈哈哈哈哈哈哈哈哈 我是小猫咪！您看看谁更像狂犬？
542,15Ativan・,Sat Nov 21 10:28:21 +0800 2020,0,为什么在网络上男人就是弱势群体了？又不是笨或者女人不讲道理 “男强女弱是老黄历” 如果认真看了新闻就不会漠视掉那些被性骚扰、家暴甚至致死的女性说出这种话吧 被性骚扰和家暴致死的男性少之又少 博主本来是提醒怎么就被刺痛了 就清华美院这一事把正义感都炸出来了 女性需要你们的时候你们在哪？
543,拳师终结者X5,Sat Nov 21 10:27:11 +0800 2020,0,我怎么生活是我的权利，为何要你来指手画脚？我怎么活干屁事？我爱怎么做就这么做，怎么高兴，怎么来，很难理解？诬告的比例 就和杀妻一样，属于极小概率的时间，在意这种事，倒不如担心你会不会被车撞了。整天在微博看个新闻也在恐慌的根本神经病。
544,八面洞,Sat Nov 21 10:26:25 +0800 2020,0,问题是进步的话没有人听，还会被退步的话嘲讽。久而久之大多数人也就放弃好好说话了。不过有一说一，我还是更想听到进步的话，至少能给这个恶臭的戾气发泄场所一点其他颜色。
545,古早味全糖去冰加奶盖,Sat Nov 21 10:26:09 +0800 2020,0,笑死了 那您膈应着吧[嘻嘻]
546,古早味全糖去冰加奶盖,Sat Nov 21 10:25:25 +0800 2020,0,hhhhh 我知道！是在嘲讽啦～毕竟有好多人就觉得他清白得不行[并不简单]
547,机械仿生孟姜女会哭倒电子长城吗,Sat Nov 21 10:24:01 +0800 2020,0,今天有一个年轻人跑进来蹦哒，问我，马老师怎么才可以避免诬告，我手法很快啊，就马上告诉他不要身体接触不就好了，没有接触就没有诬告，他很快啊，打出一段说男人一步也不能退让，不然机会变成qj犯，哎我大意了啊，没发现他就是斯文屎！于是把他补了揍了一顿，希望大家微博冲浪都要讲武德，谢谢大家
548,Baneslayer2018,Sat Nov 21 10:23:33 +0800 2020,0,可以啊然后女的犯罪率上来再杀女的，完美
549,机械仿生孟姜女会哭倒电子长城吗,Sat Nov 21 10:23:27 +0800 2020,0,今天有一个年轻人跑进来蹦哒，问我，马老师怎么才可以避免诬告，我手法很快啊，就马上告诉他不要身体接触不就好了，没有接触就没有诬告，他很快啊，打出一段说男人一步也不能退让，不然机会变成qj犯，哎我大意了啊，没发现他就是斯文屎！于是把他补了揍了一顿，希望大家微博冲浪都要讲武德，谢谢大家！
550,我就是叨叨,Sat Nov 21 10:22:19 +0800 2020,0,我的意思是，既然还没有确定是没站稳还是性骚扰，就直接判定下结论，是不是太武断了一点。男的也不一定全是咸猪手啊。我挤公交坐地铁时，会有意识的把两只手放在明处，就是怕不小心碰到被人误会
551,时代度假酒店,Sat Nov 21 10:21:00 +0800 2020,0,不想被杀就给我乖一点，贱吊
552,松果大美妞,Sat Nov 21 10:20:47 +0800 2020,0,你说什么？？那个男同学没挨骂？？？真相之前，他被所谓拳师骂穿地球了都。宁不会看不到吧？？
553,鲲鹏2020618,Sat Nov 21 10:19:34 +0800 2020,0,//@sven_shi: 这些东西你千万别信，真信有时要毁掉你的。就像清华这事情，男孩子被女孩抓着说性骚扰，他没干，为了平事当场一怂一道歉，他一辈子都是流氓。碰到这种事，对的方案一个，找第三方查监控走法律流程。任何时候你一步都不能退的。绝不要因为性别做任何的退让。
554,松果大美妞,Sat Nov 21 10:17:56 +0800 2020,0,那些小白花一边嘲讽着蝈蝻，一边搞同位女性的其他人
555,荒谬舞蹈家,Sat Nov 21 10:17:14 +0800 2020,0,你离女人远一点能死吗？该死的臭苍蝇，想被诬告吗？呸，一点也不洁身自好，人家都提示你远离陌生女性还要凑上去保持正常生活，你的正常生活正常吗？
556,松果大美妞,Sat Nov 21 10:16:48 +0800 2020,0,你说的这些情况越发严重。现在拳师们开楼不说一句吊子蝈蝻母胎就好像不是正常女性似的。
557,荒谬舞蹈家,Sat Nov 21 10:15:31 +0800 2020,0,不然你要准备好被诬告啊，那就是你自找的
558,荒谬舞蹈家,Sat Nov 21 10:14:58 +0800 2020,0,离陌生女性远一点防止被诬告，有什么问题吗？洁身自好懂不懂？
559,松果大美妞,Sat Nov 21 10:14:46 +0800 2020,0,上去
560,荒谬舞蹈家,Sat Nov 21 10:13:43 +0800 2020,0,说白了就是请离女性远一点，有什么问题吗？非要凑上去，找诬告呢？
561,小春日和畅,Sat Nov 21 10:09:38 +0800 2020,0,哪都有你这坨?? ，
562,时代度假酒店,Sat Nov 21 10:09:32 +0800 2020,0,呵呵，我并不觉得他没干。监控不也没看到是手还是书包吗？
563,时代度假酒店,Sat Nov 21 10:08:36 +0800 2020,0,因为男人脏啊。
564,时代度假酒店,Sat Nov 21 10:08:13 +0800 2020,0,我看你自尊心就挺脆弱的。
565,时代度假酒店,Sat Nov 21 10:08:05 +0800 2020,0,性别的弱势指的是你吗？
566,时代度假酒店,Sat Nov 21 10:07:19 +0800 2020,0,没一点问题，像遇到我这样的女的，把你社死也不会道歉的，被人误会活该哈。
567,猎寻在丛林中猎寻,Sat Nov 21 10:06:08 +0800 2020,0,明白人
568,拳师终结者X5,Sat Nov 21 10:05:29 +0800 2020,0,原文说的这些绝大部分都不是骚扰女性。
569,LeFort_Las,Sat Nov 21 10:05:09 +0800 2020,0,以反人类想法嘲讽反人类想法本质上依旧是反人类！以进步攻击退步，不应以退步攻击退步。
570,拳师终结者X5,Sat Nov 21 10:04:58 +0800 2020,0,蝈钕如果喜欢三从四德可以慢慢学，国蝻们没这个喜好。
571,断背山下百合开的,Sat Nov 21 10:04:54 +0800 2020,0,我见过，精神病患者，和人挤人时候
572,猎寻在丛林中猎寻,Sat Nov 21 10:03:52 +0800 2020,0,博主其实是在暗讽，以上对男孩子的要求看似不合理，但是女生一直生活在这种要求话语下你知道么，只不过博主换了主人公性别而已
573,p舟舟舟舟,Sat Nov 21 10:00:47 +0800 2020,0,骚扰女性不是你的权利，猥琐男
574,清青浅,Sat Nov 21 09:55:34 +0800 2020,0,驾照就别发给男司机了，你看男司机的事故率。男孩也堕了吧，你看杀爹杀妈杀路人杀法官的，从源头控制犯罪率[二哈][二哈][二哈]
575,沦陷于姐姐美貌,Sat Nov 21 09:55:02 +0800 2020,0,这就是蝈蝻？
576,即使变成甲壳虫也成不了甲壳虫,Sat Nov 21 09:54:45 +0800 2020,0,是的
577,炼狱-夺魄,Sat Nov 21 09:54:22 +0800 2020,0,抓紧去开一个纯女子公司，干倒金融大额行业头部地位才是你现在该做的。资本都是沙雕不是看劳动价值来给开工资，宁愿多花钱找一个价值低的男性，也不愿意花同样工资给一个价值更高的女性。他们都是沙雕??还有一句，资本没功夫歧视性别，歧视的只是能力和价值。同工才能统筹，抱怨酬劳低的多半是价值低
578,清青浅,Sat Nov 21 09:52:13 +0800 2020,0,我想起前两天豆瓣上一个帖子，一位男士觉得电梯里遇到有些女孩，一直要等到他按完按钮再按的这种行为侮辱了他。就让我觉得好好笑，理解？在开啥玩笑。
579,即使变成甲壳虫也成不了甲壳虫,Sat Nov 21 09:52:05 +0800 2020,0,哦，另外说一句，刘强东可不是诬告哦！
580,炼狱-夺魄,Sat Nov 21 09:49:35 +0800 2020,0,前几个月的罗冠军事件不会这么快就忘了吧？？？去年一个乡村教师被学生诬性骚扰搞到家庭破裂，丢了工作千夫所指最后调查就是老师对学生管的严，女学生看老师不爽诬陷的。中国类似案例有的是！如果这个男生没有清晰的监控证明他的清白。这个刚刚步入大学的清华学子。这个人一生都要背着性骚扰的骂名。
581,清青浅,Sat Nov 21 09:49:27 +0800 2020,0,好男孩就要有自我保护意识，可得提防着点。幸亏这次有监控，不然和谁说理去！支持原po！
582,Lien0608,Sat Nov 21 09:48:59 +0800 2020,0,有啊，不但见过蹭的，还见过撞的，至于你说的道歉，那也是不存在的
583,拳师终结者X5,Sat Nov 21 09:45:18 +0800 2020,0,我日常生活并不是如此，但我需要保留这些行为的权利。
584,朱武奋斗中,Sat Nov 21 09:45:14 +0800 2020,0,资本是傻雕是你自己说的，我对你的智商不做评判。算了，跟蝻蛆说话就是浪费时间
585,炼狱-夺魄,Sat Nov 21 09:44:50 +0800 2020,0,婚姻制度完全取消都不在乎。反正延迟退休，丁克重税让想生的人生，让不想生的人掏钱给别人养孩子就好啦
586,p舟舟舟舟,Sat Nov 21 09:42:51 +0800 2020,0,你的日常生活就是言语骚扰女性，公共拥挤场合故意靠近女性，对女性口嗨，就算女性不同意也要进行亲密举动，那你真是个流氓
587,Lien0608,Sat Nov 21 09:42:32 +0800 2020,0,主张者举证五个字能解决的问题，没那么复杂
588,Miraclelh_,Sat Nov 21 09:42:07 +0800 2020,0,阴阳怪气的臭沟蛆 太他妈膈应了
589,为什么窝木有名字,Sat Nov 21 09:40:37 +0800 2020,0,我的疑问是：除了韩国电影丹麦电影里，类似的事情在我国真的发生过吗？清华学姐在朋友圈诬告了男生，最后社会性死亡的是谁呢？
590,梁喵喵miao,Sat Nov 21 09:39:59 +0800 2020,0,是你一直在给我扣对立的帽子吧，这么快就忘了？是不是得去医院看看。
591,严汐_,Sat Nov 21 09:32:49 +0800 2020,0,女的不小心碰到会道歉啊
592,可乐・别加冰,Sat Nov 21 09:27:03 +0800 2020,0,逻辑感人，扣帽子一流[偷笑]??
593,ieper,Sat Nov 21 09:23:12 +0800 2020,0,这是挺搞笑的
594,炼狱-夺魄,Sat Nov 21 09:22:52 +0800 2020,0,舆论特别是男女性骚扰舆论，是不需要定罪的。有兴趣的去看一下韩国电影狩猎
595,卖不锈钢盆,Sat Nov 21 09:21:48 +0800 2020,0,你的逻辑不止一点点有问题。
596,炼狱-夺魄,Sat Nov 21 09:20:40 +0800 2020,0,弄女性专列啊，女性通道呀。某教直接给女性套上黑塑料带就可以避免很多麻烦啊[二哈][二哈][二哈]
597,卖不锈钢盆,Sat Nov 21 09:20:29 +0800 2020,0,网暴还有理了？
598,卖不锈钢盆,Sat Nov 21 09:19:18 +0800 2020,0,我觉得说得很对呀，这几点做到了，不会有人诬告你的[爱你]
599,我要不被渣浪影响的客观,Sat Nov 21 09:16:50 +0800 2020,0,女性，反对博主观点。
600,炼狱-夺魄,Sat Nov 21 09:15:55 +0800 2020,0,按照你们的思路来嘛，什么资本家都是沙雕，不看实际工作效率就看性别的。哪有你聪明啊。同样工作效率你比别人少花费20%人力成本。同样的花费比别的公司明显高出一截工作效率。那妥妥的你占尽先机啊。你弄一个纯女子企业来横扫一众资本家吧
601,瑰色夜幕,Sat Nov 21 09:14:44 +0800 2020,0,懒得一条条回复了，我是说我有看到认真道歉的才来质疑，而且是看到很多，希望大家说她被网暴咎由自取的同时思考一下女孩子本身对这种事情会很敏感并且激愤到底是啥原因。我说直白点没那么多咸猪手的消息会误认吗。。
602,不上岸不改名的考研人,Sat Nov 21 09:11:25 +0800 2020,0,不错，每天一个防止被诬告小技巧，再也不用担心自己受伤害了
603,要没时间了_daz,Sat Nov 21 09:09:56 +0800 2020,0,首先有丝分裂是一种过程， 其次人类的细胞也会进行有丝分裂， 不知道你在说啥
604,真嗣人,Sat Nov 21 09:06:53 +0800 2020,0,行啊，证据出来后反过来告你个诬告陷害罪，看哪方先留案底。
605,XZHLHLHLHLHLHLHL,Sat Nov 21 09:02:21 +0800 2020,0,笑死，到底谁无知？真核细胞分裂比无性生殖高级？有一些卵生禽类也可以无性生殖[挖鼻]
606,隐桓庄,Sat Nov 21 08:59:05 +0800 2020,0,@假装减肥的王胖子
607,XZHLHLHLHLHLHLHL,Sat Nov 21 08:57:25 +0800 2020,0,害，这可太正常了[摊手]
608,朱武奋斗中,Sat Nov 21 08:56:43 +0800 2020,0,呦，原来你也知道男女同工不同酬啊
609,朱武奋斗中,Sat Nov 21 08:55:16 +0800 2020,0,可能我们生活在平行世界吧，祝你永远别幻灭
610,想吃慕斯蛋糕的梅大侠,Sat Nov 21 08:52:51 +0800 2020,0,不会吧不会吧，不会有人觉得这真的很难做到吧，我觉得这是不需要人提醒应该自觉做到的事情啊[ok]
611,Strawberry_Q6,Sat Nov 21 08:50:12 +0800 2020,0,你别跟它讲理，看见彩虹头像就知道是狂犬，躲得远远的就行了，现实中还是我们这样正常人多，这种货还是少。
612,#NAME?,Sat Nov 21 08:48:39 +0800 2020,0,这个世界真的好魔幻 女孩子出事的时候都在劝她不要晚上一个人出门不要和陌生男性单独相处 穿的不要太暴露啥啥的 从来没有规劝男性  现在反过来让男的保护好自己不要被诬告 反而全是男的在下面骂 果然是不打到自已身上不知道疼。
613,西贤子,Sat Nov 21 08:46:14 +0800 2020,0,天呐骂你的都是男的[摊手]
614,松松啊散散,Sat Nov 21 08:38:05 +0800 2020,0,干脆把女的关起来吧？什么都要迁就？[嘻嘻]
615,梁喵喵miao,Sat Nov 21 08:36:20 +0800 2020,0,我提女医护的意义在于反驳层主的“避免招收女员工和女学生”啊，还能在哪里？你反驳别人观点的时候不需要加点事实依据的吗，这也叫对立？
616,八面洞,Sat Nov 21 08:35:17 +0800 2020,0,没有区别，就是在钓鱼
617,八面洞,Sat Nov 21 08:31:29 +0800 2020,0,正是因为社会上有“女孩子真的太可怜了所以我只要把女性堕胎就不会制造可怜人”的这种想法，博主才会顺理成章地提出这些建议。本质是对这两类的同时嘲讽。不过个人而言，我还是建议男生遵守这些规则，因为焦虑的女性越来越多，谁也说不好下一个被诬告的是不是自己
618,可乐・别加冰,Sat Nov 21 08:29:16 +0800 2020,0,我有说层主不对立？？难道只有女医护对社会有贡献？？男军人没贡献？？所以你提女医护的意义在哪里？？不招女的肯定不对啊，都2020年了
619,拳师终结者X5,Sat Nov 21 08:28:09 +0800 2020,0,社交媒体放大了原本在现实生活中很低几率才会碰到的事情，这些事情发生的几率其实是非常低的。为了这种，你一辈子都碰不到的事，来焦虑，这本身就没必要。自己好好生活就是了，过度焦虑反而会降低生活质量。
620,Persona-L,Sat Nov 21 08:26:53 +0800 2020,0,说的都对，只是吧，有种劝女生不要穿短裙吊带的味道[摊手]
621,狗不理铺儿・不理狗,Sat Nov 21 08:26:34 +0800 2020,0,现在知道难受了啊？这大约就是女孩子被告诫晚上不要一个人出门时候的感觉。。别人的错却要自己承担后果，惨吗？男同胞们。。你们难得有机会体验的百口莫辩，是女孩子的日常呢。
622,八面洞,Sat Nov 21 08:26:26 +0800 2020,0,请您解释“关了灯都一样”这句话[吃瓜]这大概是一些男性的至理名言把
623,Baneslayer2018,Sat Nov 21 08:24:24 +0800 2020,0,简单啊，分男女校呗，警察也分开管呗，女的受到伤害让女警察去处理，男的一样啊，这怎么就歧视来了，这不是你们这些拳尸梦寐以求的？
624,海淀补课天王,Sat Nov 21 08:24:16 +0800 2020,0,我可以骚，你不能扰[太开心]
625,Baneslayer2018,Sat Nov 21 08:21:45 +0800 2020,0,不是你们拳尸要我们男的远离女的么，你跟我说干嘛，你们定了规矩我们男的遵守了，你又给我扯女护士比例，你要觉得有问题你喷博主啊？
626,Baneslayer2018,Sat Nov 21 08:20:03 +0800 2020,0,开男女校啊，小男孩也要防止被小女孩诬告啊。
627,LeFort_Las,Sat Nov 21 08:13:29 +0800 2020,0,[泪]果然冷血
628,石鑫618,Sat Nov 21 08:12:51 +0800 2020,0,似是而非的劝告，其心可诛，[哈哈]，
629,朱莉玛丽还是坂本龙一,Sat Nov 21 08:11:49 +0800 2020,0,原来摸到女生的胸和屁股是因为男人大大咧咧啊..你和你爸也是这么大大咧咧的？你妈和你老婆也觉得无所谓咯？
630,小小小灰Lr,Sat Nov 21 08:11:03 +0800 2020,0,如果没有监控，现在被骂的是谁？
631,石鑫618,Sat Nov 21 08:08:53 +0800 2020,0,没别的，报警，我是说男的报警，而且只提供信息给警察，坚决不妥协，
632,Becky_在南极,Sat Nov 21 08:08:15 +0800 2020,0,不是说你希望女性在校园和职场的机会更加缩减？[疑问]博主用“女性要洁身自好少穿暴露早点回家”的文体写了一段“男德指南”你不也上钩地这么欢快。挺好啊，性别对立在这一带越来越严重好了。男人比起和周围的女性互相尊重更愿意选择利用性别红利压榨另一性别，女人这么惨那最好下一代中国没有新生儿。
633,咸鱼_某,Sat Nov 21 08:00:26 +0800 2020,0,天呐~怎么会这么想[污][污]男孩子要尽量避免在公共场合出现才是啊[悲伤][悲伤]毕竟瓜田李下~这样才不会发生被诬陷这么可怜的事[可怜][可怜]虽然我是女生，诬陷别人的女生也是少数，但我还是要说啊~可真的是为男孩子着想才会这么说的啦
634,银河有迹可循_Pluto,Sat Nov 21 07:58:42 +0800 2020,0,遇见过，怎么了[疑问] 真当没有女性针对男性女性性骚扰？
635,re54g5,Sat Nov 21 07:57:53 +0800 2020,0,你信这帮营销号胡扯[费解]，这帮营销号为了流量什么故事都能编出来，你去单位办事，是不是里面坐的都是男的?还是说你身边同学朋友没考过公务员?
636,拳师终结者X5,Sat Nov 21 07:42:28 +0800 2020,0,正常生活就是我想做什么就做什么，而不被莫名其妙的规则舒服。我的行为可能符合你的规则，也可能不符合。能自由选择的才是权力。不然只是另一种枷锁罢了。
637,拳师终结者X5,Sat Nov 21 07:41:16 +0800 2020,0,你不让我做A 不代表我一定要做B啊。无视你的规则，说明我可以选择A也可以选择B，而不是所有事情一定要做B。只做B，和可以选择做A或者B，是有区别的。
